fileid,chunk_count,chunk_indices,chunk_mic_files,audio_start_sec,audio_end_sec,audio_duration_sec,gt_dominant_spk1_doa,gt_text_file,selected_doas,mean_selected_doa_error_deg,reference_text,hypothesis_text,wer,edit_distance,ref_words
39,5,"1,2,3,4,5",mic_fileid_39_doa156_3spk_1.wav|mic_fileid_39_doa156_3spk_2.wav|mic_fileid_39_doa156_3spk_3.wav|mic_fileid_39_doa156_3spk_4.wav|mic_fileid_39_doa156_3spk_5.wav,660.0,680.0,20.0,250,text_fileid_39_doa250_spk1.txt,"156,157,239,157,178",72.6,BUT HE MADE HIS WAY DOWN TO THE FORD UNDER THE PALACE WALLS AND STEPPED INTO THE FLOODED WATER INCH BY INCH AND FOOT BY FOOT HE FOUGHT HIS WAY ACROSS NOW NEARLY SWEPT OFF HIS FEET BY SOME SUDDEN SWIRL OR EDDY NOW NARROWLY ESCAPING,[Music ] [ Music] [Music] [Music] [Music] [Music] [Music] [Music Her spirits became absolutely comfortable.,1.0,46,46
40,4,"1,2,3,4",mic_fileid_40_doa14_3spk_1.wav|mic_fileid_40_doa14_3spk_2.wav|mic_fileid_40_doa14_3spk_3.wav|mic_fileid_40_doa14_3spk_4.wav,680.0,696.0,16.0,14,text_fileid_40_doa14_spk1.txt,"17,12,13,16",2.0,WE ADVANCED TALKING IN THAT FASHION AND IN HIGH SPIRITS AND CONGRATULATING OURSELVES IN BEING SHUT OF THE TRANSPORT AND ON BREATHING FINE MOUNTAIN AIR AGAIN,We advanced. Talking in that fashion and in high spirit and congratulating ourselves in being shut off the transport and on breathing time out in air again.,0.19230769230769232,5,26
41,4,"1,2,3,4",mic_fileid_41_doa86_3spk_1.wav|mic_fileid_41_doa86_3spk_2.wav|mic_fileid_41_doa86_3spk_3.wav|mic_fileid_41_doa86_3spk_4.wav,696.0,712.0,16.0,116,text_fileid_41_doa116_spk1.txt,"236,239,240,93",97.5,WE TOOK ROOMS AT A HOTEL IN MEDWORTH QUARLES EXPLAINING THAT OUR INVESTIGATIONS MIGHT TAKE SOME DAYS NEXT MORNING INSTEAD OF GOING TO WITHAN AS I HAD EXPECTED HE TOOK ME TO THE POLICE COURT,Calling on General Sickles to the Washington Hospital . To the General and love the leg of a second day of the battle. The President was asked why he believed that victory would be ... How can Berkeley,1.0,35,35
42,5,"1,2,3,4,5",mic_fileid_42_doa76_3spk_1.wav|mic_fileid_42_doa76_3spk_2.wav|mic_fileid_42_doa76_3spk_3.wav|mic_fileid_42_doa76_3spk_4.wav|mic_fileid_42_doa76_3spk_5.wav,712.0,732.0,20.0,76,text_fileid_42_doa76_spk1.txt,"67,75,70,77,85",5.2,HOW CAN EARTHLY WORDS DESCRIBE IT IT TOWERED TEN FEET AT THE SHOULDER HAD FOUR LEGS ON EITHER SIDE A BROAD FLAT TAIL LARGER AT THE TIP THAN AT THE ROOT AND WHICH IT HELD,"words describe it ? It's how 10 feet at the shoulder had four legs on either side , a broad, flat tail , larger at the tip than at the root, and which it held . [BLANK_AUDIO]",0.2,7,35
43,4,"1,2,3,4",mic_fileid_43_doa44_3spk_1.wav|mic_fileid_43_doa44_3spk_2.wav|mic_fileid_43_doa44_3spk_3.wav|mic_fileid_43_doa44_3spk_4.wav,732.0,748.0,16.0,273,text_fileid_43_doa273_spk1.txt,"41,35,117,34",131.75,ODETTE ODETTE HE WHISPERED DON'T YOU REALISE THAT I LOVE YOU AND WOULD GIVE MY LIFE TO SAVE YOU FROM UNHAPPINESS WON'T YOU TELL ME EVERYTHING PLEASE NO NO NO SHE MURMURED WITH A LITTLE CATCH IN HER VOICE PLEASE DON'T ASK ME,">> Making so high that the heart seemed rattling from the back . Stuck us as if going on, going on, going on. >> It's not a meeting of the ants, it 's a idea of calling stuffy and I won't bless you. >> It's a decision.",1.0,43,43
44,5,"1,2,3,4,5",mic_fileid_44_doa184_3spk_1.wav|mic_fileid_44_doa184_3spk_2.wav|mic_fileid_44_doa184_3spk_3.wav|mic_fileid_44_doa184_3spk_4.wav|mic_fileid_44_doa184_3spk_5.wav,748.0,768.0,20.0,215,text_fileid_44_doa215_spk1.txt,"183,183,207,182,84",47.2,I TOO HAVE HAD MY DREAM I TOO HAVE MEDITATED I TOO HAVE SIGHED I TOO HAVE HAD A MOONLIGHT SOUL LOVE IS A CHILD SIX THOUSAND YEARS OLD LOVE HAS THE RIGHT TO A LONG WHITE BEARD,">> Pantsy proves the one right star in the film and took this point , but supposing that you charge to be poor, she insisted with our Terry Hinching. >> Cool. >> Let's do the final. >> [LAUGH] >> You need to go with your father. I'll be tired of deadening him out paying family expenses . [BLANK_AUDIO]",1.3157894736842106,50,38
45,4,"1,2,3,4",mic_fileid_45_doa62_3spk_1.wav|mic_fileid_45_doa62_3spk_2.wav|mic_fileid_45_doa62_3spk_3.wav|mic_fileid_45_doa62_3spk_4.wav,768.0,784.0,16.0,278,text_fileid_45_doa278_spk1.txt,"198,198,200,200",79.0,ONE LADY HAD A FRIGHT FOR THE WIND BLEW THE END OF HER SHAWL WITHIN REACH OF A TIGER'S GREAT CLAW AND HE CLUTCHED IT TRYING TO DRAG HER NEARER THE SHAWL CAME OFF AND THE POOR LADY RAN AWAY SCREAMING,">> That's honorary glory to whoever encounters this. >> [INAUDIBLE] >> His cajolery has brought us to Barbara Ivano va. Told me. The mob near came to her because she said something to Frankie. Oh, but it's so.",0.9512195121951219,39,41
46,4,"1,2,3,4",mic_fileid_46_doa151_3spk_1.wav|mic_fileid_46_doa151_3spk_2.wav|mic_fileid_46_doa151_3spk_3.wav|mic_fileid_46_doa151_3spk_4.wav,784.0,800.0,16.0,189,text_fileid_46_doa189_spk1.txt,"188,186,188,152",10.5,YOU'LL SEE THE ENGLISHEST LOOKING ENGLISHMAN YOU EVER SAT EYES ON OUTSIDE THE PAGES OF PUNCH TRYING TO TEAR MY OLD FASHIONED DOORBELL OUT BY THE ROOTS THAT'S YOUR BEST MAKE UP IS IT REMSEN,"You'll say that English is smoke and anger when you ever said eyes on outside the pages of punch . Trying to tear my own fashion doorbell out by the roots . That's your best makeup! In a comic scene, it is the same thing.",0.5714285714285714,20,35
47,4,"1,2,3,4",mic_fileid_47_doa63_3spk_1.wav|mic_fileid_47_doa63_3spk_2.wav|mic_fileid_47_doa63_3spk_3.wav|mic_fileid_47_doa63_3spk_4.wav,800.0,816.0,16.0,104,text_fileid_47_doa104_spk1.txt,"101,103,101,188",22.75,AT FIRST UNDER DIFFERENT ANIMAL SHAPES SINCE THAT TIME PARTLY FROM HABIT AND PARTLY TO AMUSE OURSELVES WE HAVE CONTINUED TO TRANSFORM OURSELVES AND IT WAS IN THIS WAY THAT I GOT TO KNOW YOU HOW EXCLAIMED JEGU FILLED WITH ASTONISHMENT,"At first, under different animal shapes . Since that time, partly from habit and partly to abuse ourselves , we have continued to transform ourselves . And it was in this way that I got to know you . How, exclaimed Jago, filled with his s- Thanks for the bonus, thanks.",0.21951219512195122,9,41
48,5,"1,2,3,4,5",mic_fileid_48_doa191_3spk_1.wav|mic_fileid_48_doa191_3spk_2.wav|mic_fileid_48_doa191_3spk_3.wav|mic_fileid_48_doa191_3spk_4.wav|mic_fileid_48_doa191_3spk_5.wav,816.0,836.0,20.0,227,text_fileid_48_doa227_spk1.txt,"188,223,186,225,176",27.4,APPLIED TO HER WORK BUT AFTER A FEW MINUTES SUNK AGAIN WITHOUT KNOWING IT HERSELF INTO LANGUOR AND LISTLESSNESS MOVING HERSELF IN HER CHAIR FROM THE IRRITATION OF WEARINESS MUCH OFTENER THAN SHE MOVED HER NEEDLE,"You're the last aboveboard of that same, Vett elin- Look again, without knowing it herself. Into Langer End less System. You're having over me? You, the great Velladot? Yes. Much oftener than she loves her needle. [end of transcript]",0.7222222222222222,26,36
49,4,"1,2,3,4",mic_fileid_49_doa63_3spk_1.wav|mic_fileid_49_doa63_3spk_2.wav|mic_fileid_49_doa63_3spk_3.wav|mic_fileid_49_doa63_3spk_4.wav,836.0,852.0,16.0,63,text_fileid_49_doa63_spk1.txt,"57,55,55,202",40.25,BY WHICH SOCIAL WANTS MUST BE SATISFIED THE PEOPLE DO NOT VOTE IT THE LEGISLATOR DOES NOT EXPRESS IT THE SAVANT DISCOVERS AND FORMULATES IT BUT IN FACT THE LAW,"By which social warmth must be satisfied , the people do not feel the life of slain and the no one is perfect . But the bar is covered and formulated, but it's not. [INAUDIBLE]",0.7,21,30
